{
  "name": "PlantUML Interactive Desktop",
  "description": "Intent architecture for PlantUML Interactive Desktop — a Windows application enabling drag-and-drop PlantUML diagram editing with free-position canvas, bidirectional code-canvas sync, and one-click export.",
  "elements": [
    {
      "id": "stakeholder-dev",
      "name": "Individual Developer",
      "type": "Stakeholder",
      "description": "Primary user persona: individual developer who needs intuitive PlantUML diagram editing on Windows without manual environment setup"
    },
    {
      "id": "driver-need",
      "name": "Need for Intuitive PlantUML Editing on Windows",
      "type": "Driver",
      "description": "Existing PlantUML editors are either web-based, code-only, or require complex setup. Developers want a native Windows experience with visual drag-and-drop."
    },
    {
      "id": "assessment-current",
      "name": "Current Web App Limitations",
      "type": "Assessment",
      "description": "The existing Flask web application: (1) requires browser plus running server, (2) no drag-and-drop interaction, (3) requires manual Java installation, (4) right-click modal-based editing limits UX"
    },
    {
      "id": "goal-main",
      "name": "Windows Desktop PlantUML Editor with Drag-and-Drop",
      "type": "Goal",
      "description": "Deliver a native Windows application that allows users to edit PlantUML diagrams by directly dragging elements onto a free-position canvas, rearranging them visually, and connecting them with drag-to-link interactions",
      "subdiagram_views": [
        { "view_id": "Motivation-Overview", "view_name": "Motivation Overview" },
        { "view_id": "Principles-Requirements", "view_name": "Principles and Core Requirements" },
        { "view_id": "Motivation-Constraints", "view_name": "Architecture Constraints" },
        { "view_id": "Acceptance-Install-Export", "view_name": "Acceptance: Install and Export" },
        { "view_id": "Acceptance-Interaction", "view_name": "Acceptance: Canvas Interaction" },
        { "view_id": "Acceptance-Parse", "view_name": "Acceptance: Import and Parse" }
      ]
    },
    {
      "id": "outcome-oneclick-install",
      "name": "One-Click Install with Zero Manual Setup",
      "type": "Outcome",
      "description": "User downloads a single installer, clicks Next-Next-Install-Finish, and the application is ready. JRE and PlantUML JAR are downloaded automatically on first launch."
    },
    {
      "id": "outcome-dragdrop",
      "name": "Visual Drag-and-Drop Editing Experience",
      "type": "Outcome",
      "description": "Users can drag elements from a component palette onto a canvas, reposition them freely, reconnect arrows by dragging handles, and see real-time PlantUML code synchronization."
    },
    {
      "id": "principle-free-position",
      "name": "Free Positioning Canvas",
      "type": "Principle",
      "description": "The canvas allows users to place elements at any (x, y) coordinate. Position is NOT encoded in the exported .puml file since PlantUML is an auto-layout engine."
    },
    {
      "id": "principle-last-op-wins",
      "name": "Last Operation Wins for Bidirectional Sync",
      "type": "Principle",
      "description": "When both canvas and code editor are modified concurrently, the last-touched side (by timestamp) determines the authoritative state."
    },
    {
      "id": "principle-tolerant-import",
      "name": "Tolerant Import with Unsupported Block Passthrough",
      "type": "Principle",
      "description": "When importing PlantUML files containing unsupported diagram types, the parser parses what it can and stores unrecognized text as opaque UnsupportedBlock nodes."
    },
    {
      "id": "req-activity-diagram",
      "name": "Full Activity Diagram Support",
      "type": "Requirement",
      "description": "Must support: Activity (color/URL/break/detach), Start/Stop/End, If/Else/Elseif, While/EndWhile, Repeat, Fork, Switch, Note, Group/Partition, Title, Connector, Merge, Arrow labels."
    },
    {
      "id": "req-free-canvas",
      "name": "Free-Form Canvas with Drag-and-Drop (All Three Levels)",
      "type": "Requirement",
      "description": "Canvas must support Level A (palette to add), Level B (rearrange), Level C (reconnect arrows). Elements freely positionable.",
      "subdiagram_views": [
        { "view_id": "Canvas-Interaction", "view_name": "Canvas and Palette Components" }
      ]
    },
    {
      "id": "req-export-puml",
      "name": "One-Click Export to Valid .puml",
      "type": "Requirement",
      "description": "Export button produces a valid PlantUML .puml file. Position information excluded per free-position principle."
    },
    {
      "id": "req-export-png",
      "name": "One-Click Export to PNG via Java Rendering",
      "type": "Requirement",
      "description": "Export PNG invokes java -jar plantuml.jar -tpng on the backend."
    },
    {
      "id": "req-import-puml",
      "name": "Import Existing .puml Files with Grid Layout",
      "type": "Requirement",
      "description": "Importing a .puml file parses text into AST and renders on a default grid layout."
    },
    {
      "id": "req-code-sync",
      "name": "Bidirectional Code-Canvas Real-Time Sync",
      "type": "Requirement",
      "description": "Canvas edits update code (debounced 200ms). Code edits re-parse and update canvas. Last-op-wins resolves conflicts."
    },
    {
      "id": "constraint-no-manual-java",
      "name": "No Manual Java Installation Required",
      "type": "Constraint",
      "description": "End users must never be asked to install Java, Python, or any runtime manually."
    },
    {
      "id": "constraint-no-manual-python",
      "name": "No Manual Python Installation Required",
      "type": "Constraint",
      "description": "Python backend must be PyInstaller-compiled into a standalone executable."
    },
    {
      "id": "constraint-valid-puml",
      "name": "Exported .puml Must Be Valid PlantUML",
      "type": "Constraint",
      "description": "Every exported .puml file must be parseable by standard PlantUML tooling."
    },
    {
      "id": "constraint-windows-only",
      "name": "Windows-Only Target (Installer for Windows 10/11 x64)",
      "type": "Constraint",
      "description": "The initial deliverable targets only Windows 10/11 64-bit via NSIS installer."
    },
    {
      "id": "business-process-create-diagram",
      "name": "Create PlantUML Diagram",
      "type": "Business Process",
      "description": "End-to-end user workflow: start app, add elements on canvas, arrange by drag, connect by drag, preview, export .puml or .png",
      "subdiagram_views": [
        { "view_id": "BusinessLayer", "view_name": "Business Layer" }
      ]
    },
    {
      "id": "business-object-model",
      "name": "PlantUML Diagram Model (AST)",
      "type": "Business Object",
      "description": "The authoritative in-memory representation of a PlantUML diagram as a typed AST."
    },
    {
      "id": "comp-ast-model",
      "name": "AST Data Model",
      "type": "Application Component",
      "description": "TypeScript types and model library defining node types, edge types, container hierarchy, and DiagramModel. All other components depend on this.",
      "subdiagram_views": [
        { "view_id": "AST-Foundation", "view_name": "AST Foundation Layer" }
      ]
    },
    {
      "id": "comp-puml-parser",
      "name": "PlantUML Parser Engine",
      "type": "Application Component",
      "description": "Parses PlantUML text into DiagramModel AST. Uses stack-based nesting tracking. Tolerant parsing with UnsupportedBlock fallback."
    },
    {
      "id": "comp-puml-generator",
      "name": "PlantUML Generator Engine",
      "type": "Application Component",
      "description": "Generates valid PlantUML text from DiagramModel AST. Tree-walk with depth-tracked indentation."
    },
    {
      "id": "comp-canvas-engine",
      "name": "ReactFlow Canvas Engine",
      "type": "Application Component",
      "description": "ReactFlow-based free-position canvas with custom nodes, connection handles, container nesting, drag-to-reorder, drag-to-connect."
    },
    {
      "id": "comp-palette",
      "name": "Component Palette",
      "type": "Application Component",
      "description": "Left-side panel listing draggable element types. Supports drag-to-canvas creation."
    },
    {
      "id": "comp-code-editor",
      "name": "Ace Code Editor Integration",
      "type": "Application Component",
      "description": "Ace editor wrapper with PlantUML syntax highlighting and line markers."
    },
    {
      "id": "comp-sync-engine",
      "name": "Bidirectional Sync Engine",
      "type": "Application Component",
      "description": "Manages canvas-code sync: version tracking, timestamp conflict detection, fingerprint position preservation, cycle prevention."
    },
    {
      "id": "comp-electron-shell",
      "name": "Electron Desktop Shell",
      "type": "Application Component",
      "description": "Electron main process: window management, native menus, file dialogs, subprocess management, JRE download, auto-update.",
      "subdiagram_views": [
        { "view_id": "Electron-Shell-Backend", "view_name": "Electron Shell and Backend" },
        { "view_id": "TechnologyLayer", "view_name": "Technology Layer" }
      ]
    },
    {
      "id": "comp-python-backend",
      "name": "Python Render Backend",
      "type": "Application Component",
      "description": "PyInstaller-compiled Flask app exposing render endpoints: POST /render (SVG), POST /renderPNG (PNG), GET /health."
    },
    {
      "id": "node-windows",
      "name": "Windows 10/11 x64 PC",
      "type": "Node",
      "description": "User's Windows desktop computer. Target deployment environment."
    },
    {
      "id": "tech-electron",
      "name": "Electron Runtime",
      "type": "System Software",